{
  "task_id": "task-20260305-0042",
  "parent_task_id": "task-20260305-0001",
  "intent": "SWAT escalation: diagnose and fix code_error in z02_coordination coordinator.py — original job failed with ImportError on module reload",
  "scope": {
    "machine": "x2machines",
    "repo": "x2machines",
    "zone": "z02_coordination",
    "paths": ["workspace/z02_coordination/coordinator.py", "workspace/z02_coordination/tests/"]
  },
  "constraints": {
    "method": "claude",
    "timeout_s": 900,
    "budget_usd": 18.00,
    "trust_tier": 3,
    "agent_type": "swat"
  },
  "deadline": "2026-03-05T20:00:00Z",
  "agent_affinity": [],
  "priority": 5,
  "metadata": {
    "linear_id": "PAY-1234",
    "parent_job_id": "job-20260305120000-0001",
    "zone_role": "cto"
  }
}
